{
  "assets": [
    {
      "content_type": null,
      "file": {
        "bytes_len": 39215,
        "path": "assets/69b5998a88ad03a8620e6481e212e9e3782e464dda92d7123ed1ebbfe1e553da.mjs",
        "sha256": "69b5998a88ad03a8620e6481e212e9e3782e464dda92d7123ed1ebbfe1e553da"
      },
      "headers": [],
      "serve_path": "/app-host.mjs"
    },
    {
      "content_type": null,
      "file": {
        "bytes_len": 51,
        "path": "assets/7ab6f13f4c5ba27523b4231f7015c8153236f4d3460d74eb5a78f3e6eae0aca7.json",
        "sha256": "7ab6f13f4c5ba27523b4231f7015c8153236f4d3460d74eb5a78f3e6eae0aca7"
      },
      "headers": [],
      "serve_path": "/app.manifest.json"
    },
    {
      "content_type": null,
      "file": {
        "bytes_len": 18848,
        "path": "assets/b0c5dc9de627fe97e447bbde7415434a14fd412acc8d4f9b8e91025354e72e93.wasm",
        "sha256": "b0c5dc9de627fe97e447bbde7415434a14fd412acc8d4f9b8e91025354e72e93"
      },
      "headers": [
        {
          "k": "content-type",
          "v": "application/wasm"
        }
      ],
      "serve_path": "/app.wasm"
    },
    {
      "content_type": null,
      "file": {
        "bytes_len": 2052,
        "path": "assets/4877589cbe6d79fc32598d7b1629358732456fd3e43ac45ba6b21a1d17fa9004.json",
        "sha256": "4877589cbe6d79fc32598d7b1629358732456fd3e43ac45ba6b21a1d17fa9004"
      },
      "headers": [],
      "serve_path": "/app.wasm.manifest.json"
    },
    {
      "content_type": null,
      "file": {
        "bytes_len": 2327,
        "path": "assets/f413cfc31725030c843d3e1a347d281c83c872a90e10b996b6c64db5143a89c6.js",
        "sha256": "f413cfc31725030c843d3e1a347d281c83c872a90e10b996b6c64db5143a89c6"
      },
      "headers": [],
      "serve_path": "/bootstrap.js"
    },
    {
      "content_type": null,
      "file": {
        "bytes_len": 894,
        "path": "assets/32dd8528fcd0a92d51031119e7f4b13de9b0b6120eb6dc79aa294d3a39fb7e5a.html",
        "sha256": "32dd8528fcd0a92d51031119e7f4b13de9b0b6120eb6dc79aa294d3a39fb7e5a"
      },
      "headers": [],
      "serve_path": "/index.html"
    },
    {
      "content_type": null,
      "file": {
        "bytes_len": 100,
        "path": "assets/254f54e73c2c3afea1b7b29aabded8fcd64fbe5f4f9f7fc07757b0d62a1272f0.mjs",
        "sha256": "254f54e73c2c3afea1b7b29aabded8fcd64fbe5f4f9f7fc07757b0d62a1272f0"
      },
      "headers": [],
      "serve_path": "/main.mjs"
    },
    {
      "content_type": null,
      "file": {
        "bytes_len": 1205,
        "path": "assets/5ea3290f8c2831581764a57b550f294f244e311927dfde473846b3e6ca923651.json",
        "sha256": "5ea3290f8c2831581764a57b550f294f244e311927dfde473846b3e6ca923651"
      },
      "headers": [],
      "serve_path": "/wasm.profile.json"
    },
    {
      "content_type": null,
      "file": {
        "bytes_len": 389,
        "path": "assets/27c1da04a9c073c31a913759619eebd689ee5b6e68ca8e8425f13d3c048e4947.json",
        "sha256": "27c1da04a9c073c31a913759619eebd689ee5b6e68ca8e8425f13d3c048e4947"
      },
      "headers": [],
      "serve_path": "/web-ui.profile.json"
    }
  ],
  "backend": {
    "adapter": "wasi_http_proxy_v1",
    "component": {
      "bytes_len": 106716,
      "path": "assets/57ac5a2677f094fb375bafa042e196d4f4770aaab87a8aac4264074c3867cb46.wasm",
      "sha256": "57ac5a2677f094fb375bafa042e196d4f4770aaab87a8aac4264074c3867cb46"
    }
  },
  "bundle_manifest": {
    "bytes_len": 1973,
    "path": "assets/01fe29034c4fe5700dbc492c6ff4a0c10689c0d411dc851526e8ea159618b0b7.json",
    "sha256": "01fe29034c4fe5700dbc492c6ff4a0c10689c0d411dc851526e8ea159618b0b7"
  },
  "frontend": {
    "index_path": "/index.html"
  },
  "profile_id": "app_min_release_spin",
  "routing": {
    "api_prefix": "/api"
  },
  "schema_version": "x07.app.pack@0.1.0"
}
